Fecha,Título,Enlace,Fuente,Término,Adjetivos,Sentimiento,Palabras Clave,Dominio Limpio
06/01/2026,"Acción de Ecopetrol y preferencial de Grupo Cibest, las más negociadas de la jornada",https://www.larepublica.co/finanzas/accion-de-ecopetrol-y-preferencial-de-grupo-cibest-las-mas-negociadas-de-la-jornad-4300759,larepublica.co,Ecopetrol,"['preferencial', 'negociadas']",Positiva,,larepublica.co
06/01/2026,"Acción de Ecopetrol alcanzó precio de $2.020 y tuvo un avance de 5,2% en la jornada",https://www.larepublica.co/finanzas/accion-de-ecopetrol-alcanzo-precio-de-2-020-y-tuvo-un-avance-de-4-9-en-la-jornada-4300872,larepublica.co,Ecopetrol,[],Positiva,avance,larepublica.co
06/01/2026,El programa de Ecopetrol que creó 440 empleos nuevos en Cartagena,https://www.eluniversal.com.co/cartagena/2026/01/05/el-programa-de-ecopetrol-que-creo-440-empleos-nuevos-en-cartagena/,eluniversal.com.co,Ecopetrol,['nuevos'],Positiva,,eluniversal.com.co
06/01/2026,Este 5 de enero de 2026 Afinia retomará mantenimientos en Bolívar,https://caracol.com.co/2025/12/31/este-5-de-enero-de-2026-afinia-retomara-mantenimientos-en-bolivar/,caracol.com.co,Afinia,[],Positiva,,caracol.com.co
06/01/2026,Cortes de agua en Medellín y el Valle de Aburrá: EPM anuncia los sectores afectados del 6 al 12 de enero,https://www.semana.com/nacion/medellin/articulo/cortes-de-agua-en-medellin-y-el-valle-de-aburra-epm-anuncia-los-sectores-afectados-del-6-al-12-de-enero/202644/,semana.com,EPM,['afectados'],Negativa,afecta,semana.com
06/01/2026,"Con una inversión de $24.000 millones, EPM recuperó hidroeléctrica de Sonsón, Antioquia | El Colombiano",https://www.elcolombiano.com/antioquia/epm-recuperacion-cadena-hidroelectrica-sonson-antioquia-AE32276017,elcolombiano.com,EPM,[],Positiva,,elcolombiano.com
06/01/2026,¡Vuelven a la vida! EPM reactiva hidroeléctricas en Sonsón y fortalece la energía limpia en Antioquia,https://www.pulzo.com/economia/epm-reactiva-pequenas-centrales-hidroelectricas-de-sonson-inversion-energia-limpia-y-desarrollo-local-PP4980310A,pulzo.com,EPM,"['reactiva', 'limpia']",Positiva,fortalece,pulzo.com
06/01/2026,ESSA y Sindicato de Trabajadores negocian aumento de sueldo: tendrán otros 20 días,https://www.bluradio.com/regiones/santanderes/essa-y-sindicato-de-trabajadores-negocian-aumento-de-sueldo-tendran-otros-20-dias-rg10,bluradio.com,Essa,[],Neutral,,bluradio.com
06/01/2026,¿Cómo van las negociaciones entre la ESSA y Sintraelecol?,https://www.vanguardia.com/economia/local/2026/01/05/como-van-las-negociaciones-entre-la-essa-y-sintraelecol/,vanguardia.com,Essa,[],Neutral,,vanguardia.com
